{"schema_version":1,"profile_id":"gocode-openai-responses-text/1","profile_revision":2,"provider_id":"openai","origin":"https://api.openai.com","path":"/v1/responses","model":{"request_id":"gpt-5.5-2026-04-23","model_id":"gpt-5.5","revision":"2026-04-23","aliases":[]},"pricing":{"revision":"openai-gpt-5.5-standard-short-context-2026-07-31/1","currency":"USD","unit_tokens":1000000,"input_micros":5000000,"cached_input_micros":500000,"output_micros":30000000,"long_context_threshold_tokens":272000,"long_context_enabled":false},"capabilities":["streaming"],"developer_prompt":null,"request":{"service_tier":"default","reasoning_effort":"none","tools":[],"tool_choice":"none","background":false,"store":false,"stream":true},"limits":{"max_input_entries":64,"max_input_entry_bytes":65536,"max_input_bytes":262144,"max_output_tokens":16384,"max_request_bytes":524288}}
